{
  "schema_version": "searchd-aeo-audit-v1",
  "audit": {
    "brand": "SearchD",
    "domain": "searchd.ai",
    "market": "United States",
    "language": "English",
    "measured_at": "2026-09-10T19:59:10Z",
    "measurement_method": "구매 질문별 중립 실행 1회, 독립 librarian 웹 검색 에이전트 10개",
    "scope_note": "에이전트가 측정한 웹 조사 결과입니다. 소비자 앱 노출 수나 ChatGPT, Claude, Gemini, Perplexity, Google AI Overviews를 직접 측정한 결과가 아닙니다."
  },
  "questions": [
    {
      "id": "q01",
      "text": "What are the best AEO agencies for Asian consumer brands entering the US market?",
      "intent": "commercial"
    },
    {
      "id": "q02",
      "text": "Which companies help Asian brands become visible in ChatGPT and other AI answers for US buyers?",
      "intent": "market_fit"
    },
    {
      "id": "q03",
      "text": "What services can measure whether AI assistants recommend my brand and show which competitors appear instead?",
      "intent": "commercial"
    },
    {
      "id": "q04",
      "text": "Which AI visibility services show the source pages behind an answer, not just a visibility score?",
      "intent": "comparison"
    },
    {
      "id": "q05",
      "text": "Who can help a non-English consumer brand build the English-language evidence needed for AI search in the US?",
      "intent": "market_fit"
    },
    {
      "id": "q06",
      "text": "What are the best generative engine optimization agencies for international brands expanding into America?",
      "intent": "commercial"
    },
    {
      "id": "q07",
      "text": "Which agencies audit why competitors appear in AI answers instead of my brand?",
      "intent": "commercial"
    },
    {
      "id": "q08",
      "text": "What are the best tools for tracking brand share of voice across ChatGPT, Claude, Gemini, and Perplexity?",
      "intent": "comparison"
    },
    {
      "id": "q09",
      "text": "Which companies offer a free AI visibility report that includes competitors and cited sources?",
      "intent": "commercial"
    },
    {
      "id": "q10",
      "text": "Which AEO agencies publish a measurable baseline, disclose the questions tested, and avoid guaranteeing citations?",
      "intent": "trust"
    }
  ],
  "runs": [
    {
      "id": "r01",
      "question_id": "q01",
      "agent": "aeo-q01 / neutral librarian web search",
      "agent_version": "librarian / openai/gpt-5.6-luna:low",
      "searched_at": "2026-09-10T19:59:10Z",
      "search_queries": [],
      "status": "completed",
      "brand_mentioned": false,
      "brand_position": null,
      "competitors": [
        "Foundation Marketing",
        "Pattern"
      ],
      "citations": [
        {
          "url": "https://foundationinc.co/lab/generative-engine-optimization",
          "title": "What Is Generative Engine Optimization and How To Do It?",
          "relationship": "competitor_owned"
        },
        {
          "url": "https://www.pattern.com/",
          "title": "Pattern: Global Ecommerce Accelerator",
          "relationship": "competitor_owned"
        }
      ],
      "answer_text": "There is no reliable independent ranking of AEO agencies specifically for Asian consumer brands entering the United States. Based on current public evidence, Foundation Marketing is the strongest explicit GEO strategy candidate, while Pattern is relevant when US marketplace entry and ecommerce execution are also required. Neither source independently proves results for an Asian consumer brand.",
      "answer_excerpt": "아시아 소비재 브랜드에 특화된 중립 순위는 발견되지 않았습니다. GEO 전문성에서는 Foundation Marketing, 미국 이커머스 진출에서는 Pattern이 제시됐습니다.",
      "analyst_note": "SearchD의 핵심 구매 의도에 해당합니다. 전문 업체를 찾지 못해 일반 GEO 대행사와 이커머스 운영사를 조합한 답변이 나왔습니다. 워커의 실제 검색 쿼리는 수집되지 않았습니다."
    },
    {
      "id": "r02",
      "question_id": "q02",
      "agent": "aeo-q02 / neutral librarian web search",
      "agent_version": "librarian / openai/gpt-5.6-luna:low",
      "searched_at": "2026-09-10T19:59:10Z",
      "search_queries": [],
      "status": "completed",
      "brand_mentioned": false,
      "brand_position": null,
      "competitors": [],
      "citations": [
        {
          "url": "https://openai.com/",
          "title": "OpenAI",
          "relationship": "other"
        },
        {
          "url": "https://gemini.google.com/",
          "title": "Google Gemini",
          "relationship": "other"
        },
        {
          "url": "https://www.perplexity.ai/",
          "title": "Perplexity",
          "relationship": "other"
        },
        {
          "url": "https://copilot.microsoft.com/",
          "title": "Microsoft Copilot",
          "relationship": "other"
        }
      ],
      "answer_text": "The public search did not establish a reliable company that specifically helps Asian brands become visible in AI answers for US buyers. It primarily surfaced the AI platforms OpenAI, Google Gemini, Perplexity, and Microsoft Copilot rather than a marketing or AEO provider.",
      "answer_excerpt": "아시아 브랜드의 미국 AI 답변 노출을 지원하는 검증된 업체 대신 AI 플랫폼 운영사들만 검색됐습니다.",
      "analyst_note": "구매자의 요구가 어떤 서비스 업체와도 연결되지 않았습니다. SearchD가 놓친 질문인 동시에 아직 특정 업체가 소유하지 못한 카테고리 질문입니다. 워커의 실제 검색 쿼리는 수집되지 않았습니다."
    },
    {
      "id": "r03",
      "question_id": "q03",
      "agent": "aeo-q03 / neutral librarian web search",
      "agent_version": "librarian / openai/gpt-5.6-luna:low",
      "searched_at": "2026-09-10T19:59:10Z",
      "search_queries": [],
      "status": "completed",
      "brand_mentioned": false,
      "brand_position": null,
      "competitors": [
        "BrandRank.AI",
        "OtterlyAI"
      ],
      "citations": [
        {
          "url": "https://www.brandrank.ai/",
          "title": "BrandRank.AI",
          "relationship": "competitor_owned"
        },
        {
          "url": "https://otterly.ai/",
          "title": "OtterlyAI AI Search Monitoring",
          "relationship": "competitor_owned"
        }
      ],
      "answer_text": "BrandRank.AI and OtterlyAI publicly describe services that monitor AI-answer prompts, measure whether a brand is recommended or mentioned, and identify competitors named instead. Their public claims should not be treated as independent accuracy tests, and buyers should verify metric definitions and US targeting.",
      "answer_excerpt": "BrandRank.AI와 OtterlyAI가 추천 여부, 브랜드 언급, 경쟁사 노출을 추적하는 서비스로 확인됐습니다.",
      "analyst_note": "이 질문은 SearchD의 조사·실행 서비스보다 소프트웨어 모니터링 제품에 유리합니다. 워커의 실제 검색 쿼리는 수집되지 않았습니다."
    },
    {
      "id": "r04",
      "question_id": "q04",
      "agent": "aeo-q04 / neutral librarian web search",
      "agent_version": "librarian / openai/gpt-5.6-luna:low",
      "searched_at": "2026-09-10T19:59:10Z",
      "search_queries": [],
      "status": "completed",
      "brand_mentioned": false,
      "brand_position": null,
      "competitors": [
        "OtterlyAI"
      ],
      "citations": [
        {
          "url": "https://otterly.ai/features",
          "title": "OtterlyAI Generative Engine Optimization Features",
          "relationship": "competitor_owned"
        }
      ],
      "answer_text": "In this search run, OtterlyAI was the only service explicitly verified from public product material as showing the source pages and domains behind AI answers rather than only a visibility score. Other services may provide this capability but were not verified in this pass.",
      "answer_excerpt": "이번 실행에서는 OtterlyAI만 AI 답변의 근거 페이지와 도메인을 보여주는 서비스로 확인됐습니다.",
      "analyst_note": "SearchD도 출처 단위 리포트를 제공한다고 설명하지만 이번 단일 검색에서는 모니터링 제품만 발견됐습니다. 워커의 실제 검색 쿼리는 수집되지 않았습니다."
    },
    {
      "id": "r05",
      "question_id": "q05",
      "agent": "aeo-q05 / neutral librarian web search",
      "agent_version": "librarian / openai/gpt-5.4:low",
      "searched_at": "2026-09-10T19:59:10Z",
      "search_queries": [],
      "status": "completed",
      "brand_mentioned": false,
      "brand_position": null,
      "competitors": [
        "Smartling",
        "Translated",
        "NoGood",
        "Terakeet"
      ],
      "citations": [
        {
          "url": "https://www.smartling.com/search?q=transcreation",
          "title": "Smartling Transcreation Search",
          "relationship": "competitor_owned"
        },
        {
          "url": "https://translated.com/welcome",
          "title": "Translated Professional Language Solutions",
          "relationship": "competitor_owned"
        },
        {
          "url": "https://nogood.io/answer-engine-optimization-aeo/",
          "title": "NoGood AEO Services",
          "relationship": "competitor_owned"
        },
        {
          "url": "https://terakeet.com/generative-ai-optimization/",
          "title": "Terakeet Generative AI Optimization",
          "relationship": "competitor_owned"
        }
      ],
      "answer_text": "The clearest publicly evidenced options split into two groups: Smartling and Translated for English localization and brand-voice adaptation, and NoGood and Terakeet for AEO or generative-AI visibility work. Public marketing pages do not establish performance for a specific brand or product set.",
      "answer_excerpt": "언어 현지화는 Smartling과 Translated, AI 검색 최적화는 NoGood과 Terakeet으로 문제가 분리됐습니다.",
      "analyst_note": "SearchD의 통합된 해외 진출·영어권 근거 구축 제안은 발견되지 않았습니다. 답변은 언어와 AEO 업체를 따로 조합했습니다. 워커의 실제 검색 쿼리는 수집되지 않았습니다."
    },
    {
      "id": "r06",
      "question_id": "q06",
      "agent": "aeo-q06 / neutral librarian web search",
      "agent_version": "librarian / openai/gpt-5.4:low",
      "searched_at": "2026-09-10T19:59:10Z",
      "search_queries": [],
      "status": "completed",
      "brand_mentioned": false,
      "brand_position": null,
      "competitors": [
        "TransPerfect Digital",
        "Avenue Z",
        "iPullRank",
        "NoGood"
      ],
      "citations": [
        {
          "url": "https://www.transperfect.com/blog/international-seo-what-it-takes-win-ai-era",